{
  "$schema": "./schema.json",
  "Revocation Algorithm": "Indy Revocation",
  "Implementation Support (e.g. Libraries) / Active Community": "Indy SDK",
  "Standardization (Body, Process)": "AnonCreds",
  "Recognition by government authorities (NIST, BSI, ...)": false,
  "Category": "Accumulator",
  "Observability": false,
  "Scalability": "limitations by accumulator size"
}
